[
  {
    "id": "pihole", "name": "Pi-hole", "aliases": ["pi hole", "network ad blocker"], "categories": ["dns"], "roles": ["dns-filter"],
    "upstream": {"url": "https://pi-hole.net/", "repository": "https://github.com/pi-hole/pi-hole", "docs": "https://docs.pi-hole.net/docker/"}, "image": {"reference": null, "source": "upstream", "status": "verify"},
    "lifecycle": {"status": "transitioning", "checkedAt": "2026-08-28", "note": "Pi-hole v6 changed configuration behavior; legacy v5 snippets need migration."}, "support": {"automation": "guided", "tier": "T0", "adapterSkill": null}, "homarr": {"support": "supported", "integration": "Pi-hole"},
    "dependencies": ["capability:lan-dns"], "alternatives": ["adguard-home", "technitium-dns"], "security": ["Keep administration private and confirm DNS/DHCP ownership."], "pitfalls": ["Port 53 and system resolver conflicts can disrupt the entire LAN."], "sources": ["https://docs.pi-hole.net/docker/", "https://docs.pi-hole.net/docker/upgrading/v5-v6/"]
  },
  {
    "id": "adguard-home", "name": "AdGuard Home", "aliases": ["adguard dns", "dns ad blocker"], "categories": ["dns"], "roles": ["dns-filter"],
    "upstream": {"url": "https://adguard.com/adguard-home/overview.html", "repository": "https://github.com/AdguardTeam/AdGuardHome", "docs": "https://github.com/AdguardTeam/AdGuardHome/wiki/Docker"}, "image": {"reference": null, "source": "upstream", "status": "verify"},
    "lifecycle": {"status": "active", "checkedAt": "2026-08-28", "note": "Active DNS filtering service with optional DHCP ownership."}, "support": {"automation": "guided", "tier": "T0", "adapterSkill": null}, "homarr": {"support": "supported", "integration": "AdGuard Home"},
    "dependencies": ["capability:lan-dns"], "alternatives": ["pihole", "technitium-dns"], "security": ["Limit administration to trusted networks and define fallback DNS."], "pitfalls": ["DNS, DHCP, and bootstrap ports can conflict with host services."], "sources": ["https://github.com/AdguardTeam/AdGuardHome/wiki/Docker"]
  },
  {
    "id": "technitium-dns", "name": "Technitium DNS Server", "aliases": ["technitium", "authoritative dns"], "categories": ["dns"], "roles": ["dns-server", "dns-filter"],
    "upstream": {"url": "https://technitium.com/dns/", "repository": "https://github.com/TechnitiumSoftware/DnsServer", "docs": "https://github.com/TechnitiumSoftware/DnsServer/blob/master/docker-compose.yml"}, "image": {"reference": null, "source": "upstream", "status": "verify"},
    "lifecycle": {"status": "active", "checkedAt": "2026-08-28", "note": "Broader authoritative and recursive DNS feature set than a simple filter."}, "support": {"automation": "guided", "tier": "T1", "adapterSkill": null}, "homarr": {"support": "supported", "integration": "Technitium DNS"},
    "dependencies": ["capability:lan-dns"], "alternatives": ["pihole", "adguard-home"], "security": ["Separate public authoritative service from private recursion and administration."], "pitfalls": ["A broad DNS feature set increases configuration and recovery scope."], "sources": ["https://github.com/TechnitiumSoftware/DnsServer/blob/master/docker-compose.yml"]
  },
  {
    "id": "unbound", "name": "Unbound", "aliases": ["recursive dns resolver"], "categories": ["dns"], "roles": ["recursive-resolver"],
    "upstream": {"url": "https://nlnetlabs.nl/projects/unbound/about/", "repository": "https://github.com/NLnetLabs/unbound", "docs": "https://unbound.docs.nlnetlabs.nl/"}, "image": {"reference": null, "source": "unknown", "status": "unknown"},
    "lifecycle": {"status": "active", "checkedAt": "2026-08-28", "note": "Headless DNS component; packaging must be selected for the target host."}, "support": {"automation": "discovery", "tier": "T2", "adapterSkill": null}, "homarr": {"support": "gap", "integration": null},
    "dependencies": ["capability:lan-dns"], "alternatives": ["technitium-dns", "pihole"], "security": ["Restrict recursion to intended clients and keep controls private."], "pitfalls": ["An open recursive resolver creates abuse and availability risk."], "sources": ["https://unbound.docs.nlnetlabs.nl/"]
  },
  {
    "id": "opnsense", "name": "OPNsense", "aliases": ["router firewall", "network firewall"], "categories": ["firewall", "dns"], "roles": ["network-appliance", "firewall"],
    "upstream": {"url": "https://opnsense.org/", "repository": "https://github.com/opnsense/core", "docs": "https://docs.opnsense.org/"}, "image": {"reference": null, "source": "not-applicable", "status": "not-applicable"},
    "lifecycle": {"status": "active", "checkedAt": "2026-08-28", "note": "Treat as an appliance or host boundary, not an ordinary Compose app."}, "support": {"automation": "discovery", "tier": "T1", "adapterSkill": null}, "homarr": {"support": "supported", "integration": "OPNsense"},
    "dependencies": ["capability:network-appliance"], "alternatives": ["pihole", "adguard-home"], "security": ["Changes affect routing and perimeter security; require console recovery."], "pitfalls": ["Deploying a firewall inside the workload host can create circular failure paths."], "sources": ["https://docs.opnsense.org/"]
  },
  {
    "id": "caddy", "name": "Caddy", "aliases": ["automatic https", "reverse proxy"], "categories": ["ingress"], "roles": ["reverse-proxy", "tls-owner"],
    "upstream": {"url": "https://caddyserver.com/", "repository": "https://github.com/caddyserver/caddy", "docs": "https://caddyserver.com/docs/"}, "image": {"reference": null, "source": "upstream", "status": "verify"},
    "lifecycle": {"status": "active", "checkedAt": "2026-08-28", "note": "Automatic HTTPS requires deliberate DNS, port, and certificate-state ownership."}, "support": {"automation": "guided", "tier": "T0", "adapterSkill": null}, "homarr": {"support": "gap", "integration": null},
    "dependencies": ["capability:dns", "capability:certificate-storage"], "alternatives": ["traefik", "nginx-proxy-manager"], "security": ["Make Caddy the sole approved owner of selected ingress ports."], "pitfalls": ["ACME challenge modes have different port and DNS-secret requirements."], "sources": ["https://caddyserver.com/docs/automatic-https", "https://caddyserver.com/docs/caddyfile/directives/reverse_proxy"]
  },
  {
    "id": "traefik", "name": "Traefik", "aliases": ["docker reverse proxy", "label proxy"], "categories": ["ingress"], "roles": ["reverse-proxy", "tls-owner"],
    "upstream": {"url": "https://traefik.io/", "repository": "https://github.com/traefik/traefik", "docs": "https://doc.traefik.io/traefik/"}, "image": {"reference": null, "source": "upstream", "status": "verify"},
    "lifecycle": {"status": "active", "checkedAt": "2026-08-28", "note": "Docker-provider discovery is useful but expands control-plane risk."}, "support": {"automation": "guided", "tier": "T0", "adapterSkill": null}, "homarr": {"support": "supported", "integration": "Traefik"},
    "dependencies": ["capability:dns", "capability:docker-api-boundary"], "alternatives": ["caddy", "nginx-proxy-manager"], "security": ["Protect the Docker API and authenticate the dashboard."], "pitfalls": ["The insecure dashboard mode is only suitable for an isolated lab."], "sources": ["https://doc.traefik.io/traefik/getting-started/quick-start/", "https://doc.traefik.io/traefik/providers/docker/"]
  },
  {
    "id": "nginx-proxy-manager", "name": "Nginx Proxy Manager", "aliases": ["npm proxy", "gui reverse proxy"], "categories": ["ingress"], "roles": ["reverse-proxy", "tls-owner"],
    "upstream": {"url": "https://nginxproxymanager.com/", "repository": "https://github.com/NginxProxyManager/nginx-proxy-manager", "docs": "https://nginxproxymanager.com/guide/"}, "image": {"reference": null, "source": "upstream", "status": "verify"},
    "lifecycle": {"status": "active", "checkedAt": "2026-08-28", "note": "GUI-owned proxy whose database and certificate state require backup."}, "support": {"automation": "guided", "tier": "T1", "adapterSkill": null}, "homarr": {"support": "gap", "integration": null},
    "dependencies": ["capability:dns", "capability:certificate-storage"], "alternatives": ["caddy", "traefik"], "security": ["Keep the admin interface private and protect certificate data."], "pitfalls": ["GUI state can diverge from generated project configuration."], "sources": ["https://github.com/NginxProxyManager/nginx-proxy-manager"]
  },
  {
    "id": "tailscale", "name": "Tailscale", "aliases": ["tailnet", "private phone access", "mesh vpn"], "categories": ["remote-access"], "roles": ["private-overlay", "private-ingress"],
    "upstream": {"url": "https://tailscale.com/", "repository": "https://github.com/tailscale/tailscale", "docs": "https://tailscale.com/docs/"}, "image": {"reference": null, "source": "vendor", "status": "verify"},
    "lifecycle": {"status": "active", "checkedAt": "2026-08-28", "note": "Open-source clients use a hosted commercial control plane by default."}, "support": {"automation": "guided", "tier": "T0", "adapterSkill": null}, "homarr": {"support": "gap", "integration": null},
    "dependencies": ["capability:identity", "capability:persistent-node-state"], "alternatives": ["headscale", "netbird", "wireguard"], "security": ["Use secret references for enrollment keys and review ACLs before routing services."], "pitfalls": ["Serve is private while Funnel is public; they are different approval classes."], "sources": ["https://tailscale.com/docs/features/containers/docker/how-to/connect-docker-container", "https://tailscale.com/docs/reference/tailscale-cli/serve"]
  },
  {
    "id": "headscale", "name": "Headscale", "aliases": ["self hosted tailscale control", "tailnet control server"], "categories": ["remote-access"], "roles": ["mesh-control-plane"],
    "upstream": {"url": "https://headscale.net/", "repository": "https://github.com/juanfont/headscale", "docs": "https://headscale.net/stable/setup/install/container/"}, "image": {"reference": null, "source": "upstream", "status": "verify"},